context,sense
"I know this revelation will keep you wondering why should I trust you with this informations I am about to reveal to you or if what I am saying is the truth especially with the high level of scam mails going around all over the internet, please I need you to trust and believe me if you can.",level%1:07:00::
"This way when we go out to ask for community support and are asked about our board giving level, we can show our in-house commitment through 100% board participation.",level%1:07:00::
"This way when we go out to ask for community support and are asked about our board giving level, we can show our in-house commitment through 100% board participation.",level%1:07:00::
"Your gift will enable CCI to provide these and other necessary services at a neighborhood level, face-to-face, where it counts.",level%1:26:01::
"Your gift will enable CCI to provide these and other necessary services at a neighborhood level, face-to-face, where it counts.",level%1:26:01::
---- the co-ordination of youth leadership training and youth empowerment efforts at the neighborhood level by means of neighborhood-based youth councils;,level%1:26:01::
Getting to a new level of a video game.,level%1:26:01::
"We also used an alternative approach, which assigns a different value to each level of EVGFP [ 19 ] . Preliminary results were similar for the two approaches, however, and we report results using only the simpler definition.",level%1:26:01::
"MIRACL enrolled 3,086 patients within 24-96 hours (mean 63 hours) of admission for unstable angina or a non-Q-wave myocardial infarction and randomized them to 16 weeks of atorvastatin 80 mg or placebo once daily [ 5 ] . The major exclusion criteria were: total cholesterol level greater than 270 mg/dL; Q-wave myocardial infarction on admission or during the previous month; and, coronary revascularization in the months before admission, during the index hospitalization or anticipated following hospital discharge",level%1:07:00::
"At more cranial levels within the tail, expression was localized to paraxial mesoderm, ventral neural tube, notochord and cells of the dorsal hindgut (figure 1E).",level%1:26:01::
"In the paraxial mesoderm, the highest expression levels were also localized ventrally, adjacent to the notochord (figure 1E).",level%1:07:00::
Previous studies have shown that Gad1 can be regulated at the post-transcriptional and translational level.,level%1:26:01::
"Gad1 mRNA translation or protein stability can be regulated in mature neurons by the level of GABA [ 30, 31].",level%1:26:01::
The pattern of liver enzyme abnormalities is shown in Figure 1. None of the patients with abnormal liver function tests had clinical evidence of muscle involvement that could explain the high levels of amino-transferases.,level%1:07:00::
"The event will take place: Wednesday, August 15 Four Seasons Aviara (Northern San Diego, CA) Golf Lunch will start at 11am Tee times at 12:15pm An informal reception afterwards Limited to 40 people Cost is $5k per person Dinner Reception 6 to 6:45pm Dinner 7 to 8:30pm Speakers Tom DeLay and David Horowitz $1,500 per person, $2,500 per couple There are four levels of sponsorship: $100K, $50k, $25k and $15k.",level%1:26:01::
Contribution levels will also transfer from the dinner and/or Golf Tournament to the ARMPAC &quot;contributor sponsorship program.,level%1:07:00::
"Over the past year, the Graduate School of Arts and Science has seen record level contributions from its alumni and alumnae to the School’s Annual Fund.",level%1:07:00::
"However, it reflects on a greater level both the desire of many Mayans to assimilate, as they still feel that is necessary for social mobility, and a belief among the general population that Mayans do not require a separate bill of rights as they are covered under the general rights already in the constitution (Warren 2002: 159, 172).",level%1:26:01::
"It is necessary to work within the national legal system in order to gain policy reform beyond the local level; however, with widely differing concepts of justice a a balance is difficult to achieve.",level%1:07:00::
"In addition, there exists a complex relationship between what are perceived as different levels of indigenous identity; the Nasa, for example, divide themselves into the traditional, modern, and new.",level%1:07:00::
"The unit takes in polarization levels through the two polarization-sensitive photodiodes and feeds them into the logarithm ratio amplifier, which returns the difference of the logarithmized signals from the photodiodes.",level%1:07:00::
"These stalks will need to have receptors to measure the n-alkene levels present in another ant’s cuticular hydrocarbons, which research indicates is the marker for harvester ants of a nestmate’s current task, perhaps because the hydrocarbons are altered in the dry sun, causing a different ratio of n-alkanes to n-alkenes and the presence of branched n-alkanes in the hydrocarbon profile (Wagner, et al, 2001, as cited in Gordon &amp; Greene, 2003).",level%1:07:00::
We have groups for every level of expertise and programs for all seasons.,level%1:26:01::
"If I stay still long enough, if I've achieved a relatively constant level of happiness and satisfaction, I forget that I can and should continue to seek out new ideas and approaches, and incorporate beneficial ones into my life.",level%1:07:00::
"Carolyn's supporting example, that higher level courses with more difficult and plentiful homework are worth the same amount of credit as introductory 100-level courses, drives this point home.",level%1:07:00::
"Carolyn's supporting example, that higher level courses with more difficult and plentiful homework are worth the same amount of credit as introductory 100-level courses, drives this point home.",level%1:26:01::
"After all, I could get half a unit a semester for up to four semesters--a typical class is worth one unit, and a typical physical education course of any level is worth half a unit, with a maximum of two physical education units counting toward graduation requirements.",level%1:26:01::
"At the next level up, say, aplysia, a nervous system is present, and the creature is capable of stimulus-response learning, á la Pavlov.",level%1:26:01::
"At the next level (Dennett, perhaps properly, reserves this for us vertebrates) is the Popperian creature.",level%1:26:01::
"For example, bacteria and amoebae do have a kind of Pavlovian learning already, for they have receptors that accommodate to a constant level of a given signal ligand and sense instead a change from the current level.",level%1:26:01::
"For example, bacteria and amoebae do have a kind of Pavlovian learning already, for they have receptors that accommodate to a constant level of a given signal ligand and sense instead a change from the current level.",level%1:07:00::
We found no evidence that anyone at the White House above the level of Richard Clarke participated in a decision on the departure of Saudi nationals.,level%1:26:01::
"The issue came up in one of the many video teleconferences of the interagency group Clarke chaired, and Clarke said he approved of how the FBI was dealing with the matter when it came up for interagency discussion at his level.",level%1:26:01::
A tectonic interpretation is favored because a local rise of base level cannot be involved.,level%1:26:01::
"Indeed, Lane’s (1955) argument that a stream will restore its gradient at a higher or lower level following a baselevel change is conceptually correct because if the river is initially at grade, then to move its sediment load and water discharge through the channel, the original gradient of the stream must be reestablished.",level%1:26:01::
"However, it is at the level of the individual career that we can most clearly see the micro-level behaviour that fills the relatively structure-less context.",level%1:07:00::
At a very basic level agency is about control and communion is about co-operation.,level%1:26:01::
When ‘the career’ devolves to the level of the individual does free agency prevail and a form of ‘career anarchy’ result?,level%1:26:01::
"Most poignantly, it talks about Hurricane Katrina, which focused attention on rebuilding another city with this level of devastation, and how without a single catastrophic event to blame for it, Detroit's decay has gone unsympathetically ignored.",level%1:07:00::
"It's beyond frustrating to me, as someone who has studied Constitutional Law, who competed on the the national level on it in law school, and who published an article on it, to hear people who clearly haven't done the first of these talk about it as if they know better than I do what the Constitution says, means, and is all about.",level%1:26:01::
"Thus, well-designed national cap and trade programs can help use government resources and taxpayer dollars more efficiently at both the state and federal level.",level%1:07:00::
"In the Smith/Voinovich/Brownback analysis, when we analyzed SO2 and NOx reduction levels similar to S. 556, mercury reduction levels more modest than S. 556 and no CO2 reductions, we did not find significant impacts on coal production or electricity prices.",level%1:07:00::
"In the Smith/Voinovich/Brownback analysis, when we analyzed SO2 and NOx reduction levels similar to S. 556, mercury reduction levels more modest than S. 556 and no CO2 reductions, we did not find significant impacts on coal production or electricity prices.",level%1:26:01::
"However, in the analysis responding to the Jeffords/Lieberman request that had NOx, SO2, mercury and CO2 reduction levels similar to S. 556, we found significant ramifications: approximately a 20-30% decline of coal generation and a 30-50% increase in electricity prices compared to the reference case (depending on assumptions of energy technology penetration).",level%1:26:01::
"In addition, requiring the same level of reduction at a",level%1:07:00::
"When you have a hard cap, as you would under S. 556, requiring emission reductions at a specific source does not reduce the overall level of pollution, it just limits industry's flexibility about where to make the reductions.",level%1:07:00::
"For example, depending on the ultimate cap levels chosen by Congress, this type of legislation would obviate the need for Best Available Retrofit Technology requirements, mercury MACT, and new source review case-by-case technology requirements for power generators.",level%1:26:01::
"Governor Whitman and I both believe consensus on the appropriate levels and timing for reductions of NOx, SO2 and mercury is achievable relatively soon.",level%1:07:00::
The current body of scientific knowledge does not provide information regarding atmospheric concentrations of CO2 or reduction levels necessary to prevent dangerous interference with the climate system.,level%1:07:00::
"Greenhouse gas emissions should be addressed in the context of climate change, which is being undertaken by the President's Cabinet level working group.",level%1:26:01::
Compliance with the program has been nearly 100 percent and annual emissions of SO2 from power plants have already been reduced over 6 million tons (about 35 percent) from 1980 levels.,level%1:07:00::
"Acid rain levels were dramatically reduced over large areas of the U.S. and trading did not result in geographic shifting of emissions, or &quot;hot spots&quot;, as some feared.",level%1:07:00::
" largest U.S. commercial banks held 55% of the industry’s assets, more than double the level held in 1990. On the eve of",level%1:07:00::
"It was the brain, mostly; the amount of information the machine had to process to be able to function at the level it did ate up a lot of resources.",level%1:26:01::
"Sure, Shaquille O'Neal once said,  &quot;I've won at every level but college and pro,&quot; but Shaq was always a larger than life (literally) character who was outgoing and had a great relationship with fans.",level%1:07:00::
"We also work hard and lobby for better animal welfare laws at the local, state and federal government levels and we insist they enforce existing laws to prevent animal cruelty.",level%1:07:00::
"More theoretically said this time, this local-code to exchange-code translation works much a la OSI layer (or &quot;a` la&quot;, if you don't mind :-) Data is encoded towards a lower layer, exchanged, and decoded back to same level, but possibly to a different local code.",level%1:26:01::
"It probably belongs between level 6 and 7, as it could prove that the application layer provides all the textual data.",level%1:26:01::
"But that's not sure, like for XDR which can be used from many levels to convert CPU data to line format.",level%1:26:01::
"Should we merge &quot;presentation&quot; and &quot;representation&quot; layers, split level 6 like level 2 or not assign it to any level, I'll leave the discussion to the theoricians.",level%1:26:01::
"Should we merge &quot;presentation&quot; and &quot;representation&quot; layers, split level 6 like level 2 or not assign it to any level, I'll leave the discussion to the theoricians.",level%1:26:01::
"Should we merge &quot;presentation&quot; and &quot;representation&quot; layers, split level 6 like level 2 or not assign it to any level, I'll leave the discussion to the theoricians.",level%1:26:01::
Note that the &quot;level 6 or so&quot; concept applied to text extends slightly beyond the representation of characters (and binary data) towards file structure.,level%1:26:01::
Counters of levels below top-level start at the value 0 (zero) at the start tag of the next higher (parent) level.,level%1:26:01::
Counters of levels below top-level start at the value 0 (zero) at the start tag of the next higher (parent) level.,level%1:26:01::
"Example: a numbered list with items 1, 2, 3, is followed by a paragraph of text (the || is on the same level as the |&lt;l&gt;|), and then the list continues 4, 5, 6.",level%1:26:01::
"And now, growing numbers of dolphins with malignant tumors and high levels of toxic chemicals in their tissues are washing onto U.S. beaches.",level%1:07:00::
"She is in the most active of the four levels available, but should the need arise, she can move on to assisted living facilities within the same complex.",level%1:26:01::
"The conservation groups providing information to chefs and retailers and lists of environmentally appropriate seafoods to consumers are the same groups working to affect fisheries management on the political and regulatory level, Moore said.",level%1:26:01::
"The higher levels of the union became increasingly disassociated with Youngstown and its plight, attempting to shut out the appeals from workers and local union representatives and to ignore what was really happening.",level%1:26:01::
"With many more cultures, religions, and economic levels living in close proximity to one another, a curious phenomenon has overtaken the area: regionalism.",level%1:07:00::
"What happened in Youngstown may not seem significant on an international or even on a national level, and perhaps it is not.",level%1:26:01::
"Although it affected Youngstown and the surrounding area more than it affected other regions, the local people simply could not solve a national crisis on a local level.",level%1:26:01::
"The Global Burden of Disease Database, maintained by the World Health Organization (WHO), collects data from countries around the world on risk factors such as tobacco, malnutrition, childhood abuse, unsafe sex, childbirth, and cholesterol levels, as well as on disease burdens, for example depression, blindness, and diarrhea.",level%1:07:00::
"Rodgers and colleagues used data from the WHO database for 26 risk factors and from 14 epidemiological subregions of the world to calculate the proportion of risk-factor-attributable disease burden in different population subgroups defined by age, sex, and exposure level.",level%1:07:00::
"The analysis confirms—and extends to a global level—previous research showing that many major health risks are important across the range of exposure levels, not just among individuals exposed to high levels of risk.",level%1:07:00::
"The analysis confirms—and extends to a global level—previous research showing that many major health risks are important across the range of exposure levels, not just among individuals exposed to high levels of risk.",level%1:26:01::
Rate(s) and justification: Three levels of presort discounts based on processing costs bypassed because of worksharing by mailers.,level%1:07:00::
"The last channel (5) was really hard to check because even at full volume, the sound level was very low, so may have missed some backchannels or not heard things correctly.",level%1:07:00::
"It is important to mention that our experiments were conducted at similar passage levels (passage 6 to 8) in both groups, since senescence of fibroblasts is associated with a shift from the biosynthesis of PGI 2 to TXA 2 [ 24 25 ] .",level%1:07:00::
"But really, Nathan, your queer habits of conversation have reached a new level.&quot;",level%1:07:00::
SSL connection: PayPal automatically encrypts your confidential information in transit from your computer to ours using the Secure Sockets Layer protocol (SSL) with an encryption key length of 128-bits (the highest level commercially available),level%1:07:00::
"The results I achieved were magnficent, my appetite came to acceptable level, I was in a good mood oftener, and, certainly, I became able to tighten my belt on some holes.",level%1:07:00::
"If you broaden your scope a bit, I think it would be difficult to find a time over the last 40 years or so when any of these four archetypes didn't have a level of bubbling popularity via books, comic books, tv, movies, video games, music.",level%1:26:01::
"On the outlying islands, Cheung Chau and Cheung Sha are on Lantau, and Hung Shing Ye and Lo So Shing on Lamma; inquire about water pollution levels.",level%1:07:00::
All levels of society share a feverish interest in the Sport of Kings.,level%1:26:01::
"Mr. Stronach will direct an effort to reduce overhead and curb capital spending &quot;until a more satisfactory level of profit is achieved and maintained,&quot; Magna said.",level%1:07:00::
"I want to ask you, therefore, to renew your valued World Wildlife Fund membership and, hopefully, at the Living Planet Society level of $750.",level%1:07:00::
The engine and transmission system have been upgraded to provide high performance levels in high temperature and extreme climates.,level%1:26:01::
"The explicate order is a projection from higher dimensional levels of reality, and the apparent stability and solidity of the objects and entities composing it are generated and sustained by a ceaseless process of enfoldment and unfoldment, for subatomic particles are constantly dissolving into the implicate order and then recrystallizing.",level%1:26:01::
"AOL, born under some kind of lucky star, was able to attract the right person at the right time to cause it to be able to get to the next level.",level%1:26:01::
But the level of Delta Force participation remains unknown.,level%1:07:00::
What is less clear is whether this was orchestrated from the highest levels of the Indonesian government or rather was the more spontaneous expression of officers' personal sentiments.,level%1:26:01::
"I think we are reaching new levels of cynicism in New York City politics, which can only further alienate people from civic engagement.",level%1:07:00::
And he has missed an opportunity that cannot be recovered: Morris had a level of continuous access to Reagan that no other writer will ever have.,level%1:07:00::
"But this general level of gravity is apparent in the WSJ 's quote from an arms control advocate describing the &quot;nuclear domino effect&quot; that could have just been unleashed: &quot;If we don't ratify, Pakistan and India won't either.",level%1:07:00::
"We are all multidialectal, all of the time, mastering levels of formality, adjusting content to context in speech as well as writing.",level%1:26:01::
"3. &quot;After the Nasdaq toyed with the 3,000 level on Tuesday before closing just below it, technical traders came out of the woodwork to say that breaking through 3,000 was going to be tough, because it was a 'resistance level' for the index.",level%1:26:01::
But it's just as easy to imagine that more seizures equals better law enforcement vs. the same level of production.,level%1:07:00::
This level of sustained excellence is not matched in sports or in any other aspect of society.,level%1:07:00::
"With free-agency, expansion, and three levels of playoffs, it is much harder to win today than in past years.",level%1:26:01::
"The article revealed that the director of the Brooklyn Museum, Arnold Lehman, granted the owner of &quot;Sensation&quot; 's artworks, Charles Saatchi, an astonishing level of control over the show's budget and layout; that Saatchi is now claiming that money seemingly donated was actually a loan; and that Lehman probably lied to the press as well as to potential donors about exactly how much money Saatchi had contributed and whether Lehman had personally laid eyes on the &quot;Sensation&quot; show when it was in London.",level%1:07:00::
"&quot;Kyle's Mom Is a Bitch&quot; is an infantile playground chant raised to the level of comic art by a) Cartman's speed-freak/squalling-baby vocal, b) the sophisticated Broadway-style orchestration, and c) the happy notion that people in other cultures (the Netherlands, Holland, China, Africa) would come out in full national regalia to sing about Kyle's mom being a bitch.",level%1:07:00::
"USA Today leads with the Clinton administration's proposal for establishing a nationwide computer system for rapidly tracking the course of infectious diseases like the flu and hepatitis C. The New York Times lead also connects medicine and cyberspace with a report that the rise of Americans' online pharmaceutical purchases via foreign-based Web sites has led to record levels of illegal drug imports, judging from the latest figures on Customs Service seizures of imported drugs in 1999, which ran about 4.5 times higher than 1998.",level%1:26:01::
"But what's interesting is that it isn't just stocks trading at stratospheric levels that are punished, nor is it just stocks that fall well short of expectations.",level%1:07:00::
"And in rare cases, allergic attacks can turn into anaphylaxis , where toxic levels of histamines and other chemicals are released, causing asphyxiation, vomiting, and death.",level%1:07:00::
"A piece argues that rising carbon-dioxide levels are almost certainly causing the weird weather of the 1990s, and that they will cause unimaginable devastation if the world does not slash fossil-fuel consumption soon.",level%1:07:00::
"If its marine ice sheet floats free, worldwide ocean levels could rise 20 feet.",level%1:07:00::
"&quot;[W]e have a book worthy of its subject--graceful, astonishingly well researched, yet imbued with a sense of flow that is rarely achieved at this level of scholarship,&quot; says Daphne Merkin in the New York Times Book Review . (See Sarah Kerr's review in Slate.)",level%1:26:01::
The newspaper blamed the publication of the survey for a fall by the yen against the dollar to its lowest level since May 1992.,level%1:07:00::
Rehnquist has pushed to minimize federal jurisprudence at every level.,level%1:07:00::
Massachusetts put in a tough program in November 1995 and has seen its welfare rolls drop to the lowest level in 23 years.,level%1:07:00::
"Imagine that a mad scientist went back to 1950 and offered to transport the median family to the wondrous world of the 1990s, and to place them at, say, the 25 th percentile level.",level%1:07:00::
"For some dogmatic Democrats, it seemed, any explanation would do except the obvious one--that the party wasn't speaking for a majority of voters at the national level.",level%1:26:01::
"To increase wages significantly without inflation would require a return to pre-1973 levels of real growth, which hasn't happened.",level%1:07:00::
"According to his numbers, government at all levels currently consumes about 38 percent of personal income.",level%1:26:01::
But even private savings in the 1980s ran well below their 1970s level.,level%1:07:00::
(That election was a high-water mark for student donations in a nonpresidential year--twice the level of the 1989-90 campaigns.),level%1:07:00::
"Whatever our level of acknowledgment--tabloid exploitation or elite refinement--we categorize such images intellectually and emotionally, transforming appalling scenes into objects of sentiment, pieces of evidence, and even works of art.",level%1:07:00::
"Fenfluramine increases the brain's serotonin levels (Prozac does, too, but not as dramatically) to produce a sense of satiety.",level%1:26:01::
"Not surprisingly, when the obese patients stopped taking these drugs, their weights returned to baseline levels.",level%1:07:00::
The ABI claims that there's no evidence that a 0.08 level is any more dangerous than a 0.02 level.,level%1:26:01::
"With airlines flying at 77 percent capacity in August and the Dow Jones Transportation Index at record levels, it seemed like a good time for a 5 percent fare increase, which, says USAT , most of the major domestic airlines put into place last week.",level%1:07:00::
"The lower level of the Guggenheim SoHo displays the tinkering side of Rauschenberg's nature, the works he made in collaboration with engineers--the star item there is unquestionably Mud Muse (1968-71), a vat of bentonite (an artificial clay) that bubbles and gurgles and spits, like a pool of quicksand in a Tarzan movie, triggered by a sound-activated compressed-air system.",level%1:07:00::
