context_x,context_y
"Relieved of those constraints in Angel , Carter Eskew, who produced spots for the 1992 Clinton campaign, has sculpted a decidedly nonpolitical spot that evinces clearly his sense of relief at having to make only one powerful point.",sense%1:09:05::
Cow recruits the next generation of Nike wearers by building a bridge between young people's innate sense of play and the next stage--competition.,sense%1:09:05::
The spot makes sense either way.,sense%1:09:04::
"But the helmeted riders around the limousine, the fluttering flags atop it, the stoplights freezing oncoming traffic--all create an undeniable sense of moment.",sense%1:09:05::
The call for solidarity reaches beyond the issue at hand to tap a deeper sense of ethnic and cultural identification.,sense%1:09:05::
"Traditional scholars respond that, while the Bible may have a shaky sense of chronology, to dismiss the text entirely is irresponsible.",sense%1:09:05::
"The only poll that I've heard about that makes any sense, which may be the one the GOP is reading, is the ABC News survey (I think) saying that 69 percent of Americans would clear Clinton if he makes a clean breast of it.",sense%1:09:04::
"First, a critical question of interpretation: From my sense of her body language and tone, Monica was clearly checking to make sure the phone would not disturb the X-ray machine.",sense%1:09:05::
"The editors front the story as high as they can because they know there really was a loss here, of a combination of talent and a larger sense of purpose that is utterly absent from entertainment today.",sense%1:09:05::
I want to give the grand jurors a sense that they really are in the room with him.&quot;,sense%1:09:05::
"Republicans and Democrats commend Helms for his good sense, flexibility, and bipartisanship (?!)",sense%1:09:04::
"Crime, and a broad sense of civic disorder, probably had more to do with Dinkins' defeat than spending did.",sense%1:09:05::
"&quot;Roy gives us a richly pictorial sense of these characters' daily routines and habits,&quot; said Michiko Kakutani in the New York Times , &quot;and she delineates their emotional lives with insight and panache, revealing the fatal confluence of jealousy, cruelty and naivete that shapes their destinies forever.&quot;",sense%1:09:05::
"Eszterhas is reminiscent of Playboy 's Hugh Hefner: They share the same exaggerated sense of importance, the same pontificating humorlessness about their ridiculous jobs.",sense%1:09:05::
"The higher that cost, the larger the transaction has to be in order for it to make financial sense.",sense%1:09:04::
Put another way--micropayments make sense only when they match the fundamental economics of the product or service better than other ways of charging.,sense%1:09:04::
"It is possible for a very skillful writer to convey in plain English a sense of what serious economics is about, to hide the algebraic skeleton behind a more appealing facade.",sense%1:09:05::
"No, to make sense of the claim that savings are bad you must argue either that interest rates have no effect on spending (try telling that to the National Association of Homebuilders) or that potential savings are so high compared with investment opportunities that the Fed cannot bring the two in line even at a near-zero interest rate.",sense%1:09:04::
"Iam always grateful when influential pundits make such statements, especially in prominent places, for in so doing they protect us from the ever-present temptation to take people seriously simply because they are influential, to imagine that widely held views must actually make at least some sense.",sense%1:09:04::
"Anyone who claims to fully understand the economic disaster that has overtaken Asia proves, by that very certainty, that he . The truth is that we have never seen anything quite like this, and that everyone--from the country doctors at the International Monetary Fund and the Treasury Department who must prescribe economic medicine to those of us who have the luxury of irresponsibility--is groping frantically for models and metaphors to make sense of this thing.",sense%1:09:04::
"But if you subscribe to the &quot;Daily Me,&quot; this arrangement makes no sense, because every Me is different.",sense%1:09:04::
"Rich or powerful married men feel an extravagant sense of sexual entitlement, and many women feel like gratifying it.",sense%1:09:05::
Such differences in behavioral strategy do make Darwinian sense.&quot;,sense%1:09:04::
It isn't obvious to me how a baby would develop a robust sense of autonomy while being confined to a small cubicle with bars on the side and rendered powerless to influence its environment.,sense%1:09:05::
But a deeper reason for investigating bequests is that they reveal something about people's instinctive sense of justice.,sense%1:09:05::
"To make sense of that theory, you have to ask why dry cleaners would want to discriminate specifically against women, as opposed to, say, men.",sense%1:09:04::
That strategy makes sense only if men are more price-sensitive than women and hence more likely to walk away in the face of a high markup.,sense%1:09:04::
"But as long as we're dealing in stereotypes, you could argue equally well that women are more willing to do their own laundry--in which case women would be more likely to walk away from a high price, and it would make more sense to discriminate against men.",sense%1:09:04::
"One way to accomplish that is to pay FDA officials not in cash but in pharmaceutical company stock, which ought to introduce an appropriate sense of urgency to the drug approval process.",sense%1:09:05::
We need a more dynamic model to get a real sense of what's going on.,sense%1:09:05::
Perhaps NIDA and the pliant journalists should inject themselves with a big dose of common sense.,sense%1:09:04::
"Jeffrey Steingarten will be writing monthly on food (&quot;In the Soup&quot;), Anne Hollander on fashion (&quot;Clothes Sense&quot;), and Margaret Talbot on &quot;Men and Women.&quot;",sense%1:09:04::
But this pat explanation doesn't entirely make sense.,sense%1:09:04::
The first question Westin should have asked himself is whether it ever makes sense for a news organization like ABC to climb into bed with an advocacy organization like the partnership.,sense%1:09:04::
"If group preferences are wrong in principle, as these opponents maintain, none of their exceptions makes much sense.",sense%1:09:04::
"Does it make sense for each state to be deciding that question all over again--either agreeing, in which case the effort is redundant, or disagreeing, in which case the result is a toaster that is legal in Ohio but illegal in Kentucky?",sense%1:09:04::
a) No sense of proportionality.,sense%1:09:05::
b) Had good sense to leave the White House before corrupting himself.,sense%1:09:04::
"But, even if Clinton were to parcel the existing programs out to other departments without appreciably reducing their cost, it would still make political sense to dump DOE.",sense%1:09:04::
"This makes sense because some of these women will rise to the occasion, learn the work ethic, and become self-supporting.",sense%1:09:04::
"It would hardly make sense to hand out $1,000 payments to men for taking home a bunch of condoms, or to try to police their use.",sense%1:09:04::
The excesses of sexual-harassment regulations are popular targets for defenders of common sense because feminism remains a target for pundits on the right--and the concept of harassment remains controversial.,sense%1:09:04::
"With the advent of crack cocaine in the mid-1980s, the civic credos of &quot;getting tough&quot; and &quot;just saying no&quot; carried the weight of common sense and enjoyed sway in schools, print, and on the airwaves.",sense%1:09:04::
At worst they redirect investment capital from uses that make economic sense to those that don't.,sense%1:09:04::
"However, I am not so ignorant of the canons of journalism (and of common sense) that I would take a plausible fellow like Brian Arthur at face value without checking up on him.",sense%1:09:04::
There's only one problem with this: It makes no sense.,sense%1:09:04::
But it only makes sense to speak of low returns and low margins if you're making products to sell to others.,sense%1:09:04::
"Such seems to be the curious strategy of the world auto industry in the late 1990s, as it grapples with prices that are actually declining, demand that's stagnant, and production capacity that, against all good sense, just keeps getting bigger.",sense%1:09:04::
"When OPEC raised its prices far above its production costs, it made sense to develop fields that previously had been too expensive.",sense%1:09:04::
"If your reserves are infinite, though, it makes sense to worry less about price and more about maximizing output, since your source of cash is never going to dry up and force you into another line of business.",sense%1:09:04::
"If Viacom were using its Nickelodeon-induced expertise in appealing to the 9-year-olds market to sell children's books better, or taking what it's learned from MTV to make readers out of disgruntled teen-agers, the idea of synergy would make more sense.",sense%1:09:04::
"But while from a short-term dollars and cents angle reinstating the workers may make sense, throughout its struggle with the UAW, Caterpillar has made its decisions with one long-range goal in mind: consolidation of its control over the workplace.",sense%1:09:04::
"Daimler is going to have to be able to make and sell more Mercedes more cheaply because it has acquired Chrysler, and vice versa, for the deal to make sense.",sense%1:09:04::
"And with a $13 billion premium, the deal has to make an awful lot of sense.",sense%1:09:04::
"In evolutionary terms, this makes sense.",sense%1:09:04::
"The paper also quotes a second Wall Streeter saying, &quot;There is no sense of urgency like in 1987.",sense%1:09:05::
"He's represented not just by his homicide victims and his famous shot of The Critic (two grande dames in evening dress stepping out from their limo as a bag lady appraises their fashion sense), but by a 20-minute film, called Weegee's New York (1953), as well.",sense%1:09:04::
"The puzzling decision to relegate the painter of sun-drenched tablecloths and rainbow gardens to the underground makes some sense given the direction and drift of the show, the third MoMA retrospective of Bonnard's work since his death just shy of age 80 in 1947.",sense%1:09:04::
"In this regard, he argues, the American choice for a leveling democracy &quot;makes abundant sense.&quot;",sense%1:09:04::
But other suggestions make sense.,sense%1:09:04::
"To begin with, the purported contrast between the blinkered maxims of economic theory and the penetrating insights of Kuttner's common sense is a fraud.",sense%1:09:04::
"In his awkward novel, Rosen captures two awkward, important truths about anorexia: that its peculiar logic is not just tragic but comic, and that despite the fascination it holds for those who suffer from it, and for those who seek to make sense of it, anorexia is in fact quite boring.",sense%1:09:04::
His poetry makes little sense in conjunction with anyone else's.,sense%1:09:04::
"But it's also true that had she been wearing, in the name of Good Sense, elaborate running shoes--with their ridiculous thickness and multiform brightness--they would have struck the eye as equally attractive and equally absurd.",sense%1:09:04::
"The exhibition tells us that as a vessel of lasting sense or sacred truth, the written word may be losing ground, but that as a source of inarticulate comfort, it has gained much.",sense%1:09:04::
Some mechanism was needed to make sense of it all.,sense%1:09:04::
"(It makes sense that the London production was more successful than the American one, and that the director and two of these three actors in the film are English.",sense%1:09:04::
"My Anderson frenzy might make sense if I were, say, a compulsive gambler who'd pawned his fiancee's engagement ring to wager against Kentucky.",sense%1:09:04::
"Living it through, giving it order and style.And one had the sense of the late marriage as ofTwo bafflements inventing the sense they made Together.",sense%1:09:04::
"It's just common sense that same sex doesn't automatically mean no harassment, but the reporting on the decision makes it clear that the legalities have been murky.",sense%1:09:04::
