context,sense
"If it was simply a matter of selecting a text that gives two contradicting scientific theories equal time, that would be an entirely different matter, but it's not.",time%1:28:05::
"With everybody's indulgence, I would expect to go to approximately o'clock, no later than o'clock tomorrow to make up for the time that we lose during the morning session.",time%1:28:05::
"Now, I don't have time to preside over a deposition at this late date.",time%1:28:05::
"And it will be abbreviated because of the time constraints on me, but we'll issue it forthwith, and it will indicate that you're going to -- they're going to sit for depositions under those circumstances.",time%1:28:05::
"I was actually nine months pregnant and due any day, so I spent quite a deal of time in the restroom.",time%1:28:05::
And so at the time when Max was speaking -- I believe that there were people who spoke in between she and Max Pell.,time%1:28:05::
"And so I pretty well made sure, at the beginning of that meeting, which went on for quite a long time, that I wouldn't miss anything, so I took care of my bathroom needs beforehand.",time%1:28:05::
"Now, during the time that you were at the meeting, did you hear any discussion among the board members about the reasons for the proposed change to the biology curriculum?",time%1:28:05::
"And is it your understanding that because Dover is a standards-driven district, that they're going to focus their class time on preparing students to achieve proficiency on those standard-based assessments?",time%1:28:05::
"They'd scouted twenty-seven gates so far, and none had turned up anything worth the Insurrection's time.",time%1:28:05::
"He spends his time drunk on excellent local wines, fantasizing a very fulfilling populist Catharism.",time%1:28:05::
"&quot;Thank the Goddess of Compassion Quan Yin, she didn't have time to develop a pesky &quot;self,&quot; comments Merle's fading bark.",time%1:28:05::
"He doesn't have much time today, as his friend Mary (a model for MonaLisa of the Desert) is coming down from the central coast and Walt, another friend, may join them for dinner. &quot;",time%1:28:05::
"A dog is said to have herded a little boy who was running toward the water back to his family in the nick of time, exhibiting the shepherd instinct in his breeding.",time%1:28:05::
"As we children of the baby boom grew older we had more free time than any previous generation on earth, free time to undergo the tidal waves of adolescent hormones and to read Catcher in the Rye and even On the Road in study halls, although we also memorized Pledges of Allegiance, Declarations of Independence and believed them.",time%1:28:05::
"As we children of the baby boom grew older we had more free time than any previous generation on earth, free time to undergo the tidal waves of adolescent hormones and to read Catcher in the Rye and even On the Road in study halls, although we also memorized Pledges of Allegiance, Declarations of Independence and believed them.",time%1:28:05::
These Horites are first mentioned at the time of Abraham in connection with the subjugation of the land by Chedorlaomer.,time%1:28:05::
I have spent a lot of time thinking and writing about the quality of urban life for families and not just for the tourists most mayors think are the key to urban regeneration.,time%1:28:05::
"Even granting that Chatterbox had one or two other minor tasks to complete today, it does seem that seven hours is more time than any reasonable person should have to spend reading about the genesis of a single-topic edition of a Sunday magazine.",time%1:28:05::
"Or so the story says, quoting five experts in support along the way, before swerving abruptly to a &quot;to be sure&quot; 11th paragraph that says Y2K preparedness &quot;posed an enormous distraction, soaking up time and money that might have been plowed into projects with a more immediate payoff,&quot; and that &quot;much of the investment went to inoculate older technology against the computer bug rather than to embrace the newest processes that could revolutionize the way work is done.&quot;",time%1:28:05::
1) The White House has already contacted the networks to reserve television time (on either Aug. 16 or Aug. 17) for a Clinton apology.,time%1:28:05::
"--comprising guys who have gained 50 pounds since high school, guys who know their way around a search engine but, what with the wife and the child support and the gas bills and all those $7 bottles of wine, lack the loose dollars and idle time that can b",time%1:28:05::
"Paradoxically, the timesaving is more real the smaller the amount of time to be saved.",time%1:28:05::
"Aside from the hours spent documenting such feats, and recovering from them, Burden's art didn't occupy much of his time.",time%1:28:05::
Would it reach us in time to fend off the snow?,time%1:28:05::
"Elway said he is retiring because his knee is damaged, he has accomplished what he sought in football, and he wants to spend more time with his family.",time%1:28:05::
"); Macedonia (&quot;It has suffered from loss of trade with Serbia, and most of the refugees are unlikely to leave for some time.&quot;",time%1:28:05::
"On the third pass, recalling Proust's admonition to one of his correspondents that if he'd only had time he would have written a shorter letter, I managed to cut another 200 pages.",time%1:28:05::
"The IRS didn't dispute the charges, but attributed the problems to outdated computers and personnel turnover, problems it's addressing, says the paper, but which take time.",time%1:28:05::
"Or to give equal time, as it were:",time%1:28:05::
#NAME?,time%1:28:05::
"In short, I am not what is known in the trade as “copy proud”:my feelings about my own writing range from occasional smugness with a job well done to abject frustration and misery at my inability to express myself articulated in writing (given the amount of time and resources available).",time%1:28:05::
"I was turned down, but not entirely discouraged, and decided to return to the fray several years later, when I had more time.",time%1:28:05::
We also hope you'll take time out from your spring planting to make a gift in honor of Joe's garden.,time%1:28:05::
"Just a moment of your time, if you can, to talk about a ten dollar bill.",time%1:28:05::
It takes a long time for him to gain the self-confidence to work elsewhere in the community.,time%1:28:05::
He has no time to waste.,time%1:28:05::
The people who can benefit most directly from your generosity have no time to waste.,time%1:28:05::
We don't waste time as we are helping the community.,time%1:28:05::
"It took some time and hard work, but with the help of Goodwill, Jerry was able to work out a payment plan with the prosecutor's office, find housing and conduct a more thorough job search.",time%1:28:05::
"A time for a youngster to enjoy the fun and benefits of residential camp living, dedicated staff and instruction, and a chance to make special friends.",time%1:28:05::
The Grill will feature enough activities that you and your kids will have a tough time deciding what to do.,time%1:28:05::
"With this in mind, I am asking each one of you to make a personal contribution of $50, $100 or even $1,000 to show that you believe in the work that we do and are willing to support it with both your time and your finances.",time%1:28:05::
We believe there is no more appropriate time to have a coordinated and collaborative effort to financially support the services MCCOY offers to the community as a whole.,time%1:28:05::
"Thank you very much for your time, attention and consideration.",time%1:28:05::
"I am a board member of SEND and would like to spend a few moments of your time in the near future to tell you, personally, about our programs and how you can help.",time%1:28:05::
"In addition to running DBA, Miyares finds time to be liaison for blinded veterans at the San Diego VA Medical Center, an inventor, lecturer, member and co-founder of the Mira Mesa/Scripps Ranch Chamber of Commerce, author, business columnist for the &quot;San Diego Union-Tribune newspaper, co-host of &quot;San Diego Inventors and Inventions&quot; on KFMB-TV, and many other business, military, civic, and athletic organization activities.",time%1:28:05::
"Even if we have not engaged in formal extracurricular activities, however, many more of us have helped each other-by reviewing homework problems in one of the student lounges, by participating in group projects in classes--meeting sometimes after class hours, by taking time to listen to a classmate's personal problems, or just by socializing between classes.",time%1:28:05::
Among the many traditions of the holiday season is taking time to reflect upon the things in our lives that add meaning.,time%1:28:05::
Take the time to stop by and visit Indianapolis' Center for Contemporary Art.,time%1:28:05::
"Had I known such strange events would occur, I assure you I would have spent much more time studying physics in Minshall Lab and less time playing bridge in the Hub.",time%1:28:05::
"Had I known such strange events would occur, I assure you I would have spent much more time studying physics in Minshall Lab and less time playing bridge in the Hub.",time%1:28:05::
"Whether you attended classes full time, were an adult returning student, or worked full time in a career while taking classes, I believe you know first hand how important it was that Liberal Arts was open and available to you--and you also know how important it still is.",time%1:28:05::
Perhaps you were one of the many students who were able to spend some time on a research project with Dr. Phillips or one of the other members of the Department of Dental Materials.,time%1:28:05::
"We appreciate your taking time to read about Futures for Children, I hope you are inspired to become a Sponsor and/or a Member.",time%1:28:05::
"For the same time period, our alumni participation in similar firms was 31% to 67%.",time%1:28:05::
"For the second year, the campaign was managed by the law school and current law students volunteered their time to call alumni.",time%1:28:05::
"It would be wonderful if you could take the time to visit your School, and see for yourself the progress we have made over the years and share in the pride of our heritage!",time%1:28:05::
"I hope you will spend some time at the IMA this holiday season, and thank you for your support of the Annual Operating Campaign.",time%1:28:05::
I have a place where dreams are born And time is never planned; It's not on any chart You must find it with your heart Never never land.,time%1:28:05::
"The time saved in production can be lost if the distribution method is slow, or if there are other impediments to the movement of products from the apparel-maker to the retailer.",time%1:28:05::
"Successful performance includes providing high levels of order completeness, short lead times for new products, and rapid response to requests for replenishment.",time%1:28:05::
"This supplier must draw on production lines and sourcing arrangements that provide it with a range of response times, from short-cycle production capacity for products with high demand variability to lines or sourcing arrangements that create larger production runs at lower costs for items with low demand variability.",time%1:28:05::
"Instead of breaking up sewing into a long series of small steps, modular production entails grouping tasks and assigning them to a team to reduce the elapsed throughput time required for assembling a given product.",time%1:28:05::
An established channel in which the various parties focus on time to market results in markedly different supply decisions and dynamics than those dictated by conventional direct labor costs of supplies.,time%1:28:05::
"The capability to compete increasingly depends on an enterprise’s ability to manage operations according to the logistics of time and flow of product, reducing time to market and the costs of holding inventory.",time%1:28:05::
Our research suggests that the cycle time of a fast production line should be no more than a week or two to be an effective alternative for the lower costs of a long-cycle line or plant.,time%1:28:05::
"With the establishment of an independent operating unit, Federated Logistics, this retailer reduced the amount of time required to process merchandise in distribution centers by 60 percent, to an average of two days.",time%1:28:05::
"A retailer’s decision about what to stock will depend on a variety of considerations, including the demand forecast for the product, the level of product availability it wishes to provide to customers, the frequency with which it will place replenishment orders, and the lead time to acquire replenishment units.",time%1:28:05::
"Once again, if lead times are uncertain, retailers must hold additional safety stock to meet demand in the event of an unusually long lead time.",time%1:28:05::
"It can be shown that high variability in lead time means higher costs for retailers than somewhat longer, but more reliable lead times; that is, it may be better to have a longer reliable lead time than an unpredictable one with a shorter average duration.",time%1:28:05::
"But given the increasingly short lead times dictated by retailers (often just a couple of days), most manufacturers cannot produce in this way.",time%1:28:05::
"Similarly, the impact of alternative methods for reducing plant cycle time depends not only on the direct costs of changes, but also on the reductions in inventory levels allowed by shorter lead times.",time%1:28:05::
"Caught between lean retailers’ need for immediate replenishment and the high risk of carrying inventory for products with uncertain demand, a manufacturer today must go beyond traditional direct costs and also include manufacturing lead times and inventory carrying costs in its sourcing equation.",time%1:28:05::
Here we will show how a decision tool can be used to make the transition from general intuition to specific decisions about (1) which products to make in each plant and (2) how to schedule the time and quantity of production for each product.,time%1:28:05::
"The cost to produce a unit and deliver it to the distribution center is known for each plant, as well as the time it takes.",time%1:28:05::
"However, at least one general rule emerges from the cases we have studied: The cycle time of a fast production facility can be no more than a week or two.",time%1:28:05::
The use of modern design tools and information technology can collapse the design time so that managerial decision-making becomes the longest step in the process—and even the time for that step can be shortened with information technology.,time%1:28:05::
"Computerized design systems collapse the time needed to explore new design ideas into hours of work, rather than the traditional work time of days or weeks.",time%1:28:05::
"Computerized design systems collapse the time needed to explore new design ideas into hours of work, rather than the traditional work time of days or weeks.",time%1:28:05::
"No matter how the measurements are taken, most people being measured in this way have a difficult time standing up straight and holding in their stomachs.",time%1:28:05::
"In many cases, it has shortened the cycle time from order to ready for sewing by half.",time%1:28:05::
"If a part must be reworked, it is done on the operator’s own time.",time%1:28:05::
Some of the forty operations require very little time; others are much longer.,time%1:28:05::
"A competing approach to reducing plant throughput time involves team-based sewing or modular production, which we will discuss at length in the next chapter.",time%1:28:05::
"Cruising slowly and smoothly, sitting low in the driver’s seat, glancing out at the street, nodding the head slightly when being recognized, all these make up an experience only a Chicano low rider who has invested lots of time and money in his car can appreciate.",time%1:28:05::
"Starting in the late 1940s and into the present, la migra made raids in the San Joaquin Valley of California, rounding up braceros who had overstayed their contract time allocation.",time%1:28:05::
"Mexicans who have spent time in the United States and have acquired the mannerisms, values, and the English language may be considered pochos because they’ve become agringados (anglicized).",time%1:28:05::
"This hypothesis asserts that the trajectory of states leading from the initial state in a long stringlike “walk” will, over time, spend as much time in any small 6N cube as in any other cube.",time%1:28:05::
"Since vastly many more small cubes correspond to the nearly uniform distribution of particles, moving in all possible directions but bunched around an average velocity, it follows from the ergodic hypothesis that the system will have spent most of its time in this “equilibrium” macrostate.",time%1:28:05::
"The second law, in its modern understanding, is simply the statement that an isolated thermodynamic system will tend to flow away from improbable macrostates = corresponding to very few of our tiny 6N-dimensional cubes = and flow into and spend most of its time in the equilibrium macrostate for no better reason than that that macrostate corresponds to vastly many small 6N cubes in the entire 6N-dimensional phase space.",time%1:28:05::
"Thus, cells carry out measurements and record them all the time.",time%1:28:05::
"But is infinitesimally small compared to the number of possible proteins of length , namely, . In short, the known universe has not had time since the big bang to create all possible proteins of length once.",time%1:28:05::
"Indeed the time required to create all possible proteins at least once is at least the ratio of possible proteins to the maximum number of reactions that can have occurred in the lifetime of the universe, or times the lifetime of the universe.",time%1:28:05::
"Buildings are extremely complicated artifacts, and the time necessary to cultivate and refine a particular manner of building cannot be underestimated.",time%1:28:05::
"In a relatively short time he produced an impressive body of work that includes institutional, commercial, and residential buildings.",time%1:28:05::
Bin Ladin and Atef wasted no time in assigning the Hamburg group to the most ambitious operation yet planned by al Qaeda.,time%1:28:05::
"Listed reasons (and number of patients) for missing exercise time data at 24 weeks were: 'exercise test not done due to death' (n = 30), 'exercise testing contraindicated' (n = 9), and 'exercise test not done for other reasons' (n = 10).",time%1:28:05::
Alignment of a small subunit (SSU) ribosomal RNA sequence to the SSU rRNA consensus structure would take about 23 GB of RAM and an hour of CPU time.,time%1:28:05::
"Once damage is sensed, the checkpoint delays the cell cycle to allow DNA repair enzymes sufficient time to execute their activities.",time%1:28:05::
This gives sufficient time for the fibroblasts to express and deposit collagen in the ECM.,time%1:28:05::
The fluctuation in the total absorption points at long times in fig.,time%1:28:05::
"It examines the control technology's hardware, reagents, availability of the needed construction equipment, time required to implement at plants with single and multiple installation requirements, and the availability of labor needed for installation.",time%1:28:05::
"One company emphasized that if a major milestone is delayed, an appropriate adjustment should be made to the end date of the program, thereby avoiding compressing the time allotted for the rest of product development and managing the risks that subsequent milestones will be missed.",time%1:28:05::
"In keeping with GAO's values of being fair and balanced in its work with all agencies, GAO has articulated its criteria for determining the amount of time available for agency comments on GAO's products.",time%1:28:05::
Contract management includes the steps required to ensure that the agency receives products and services within established costs and time frames.,time%1:28:05::
"The work by the Larimer County Bar Association has been going on for 18 years, and in that time several thousand clients have been served.",time%1:28:05::
"Instead, the state depends on 41 local not-for-profit organizations, funded at $54 million a year, and the $172 million in time donated by members of the Bar to serve these needy families.",time%1:28:05::
"To measure the workload elements needed to calculate the evaluated time, a National Mail Count for most rural routes is conducted periodically in accordance with the labor agreement between the United States Postal Service and the union of rural carriers.",time%1:28:05::
"Route time costs are essentially fixed, while access is partly variable, and",time%1:28:05::
"Now, is it your recollection that the first time the Pandas book was mentioned was during the July meeting that you attended?",time%1:11:00::
"So it would not revert back to an unprotected realm, if you will, at the time of trial.",time%1:11:00::
"I mean, if that's what it says in my deposition testimony, that's what I testified to at the time.",time%1:11:00::
"Not at this time, Your Honor.",time%1:11:00::
"The Court was advised that yesterday, on September the 27th, the reporters, both of them, showed up at the appointed times for their depositions as appropriately scheduled by the defendants, and I'm advised -- and I'll correct this if I'm wrong -- that both reporters cited the reporter's privilege that they consider to exist under the First Amendment so that they would not answer any questions at those depositions.",time%1:11:00::
"I believe that to the extent -- and I've said this now several times -- that the reporters' testimony is necessary in order to invoke the residual hearsay exception under Rule 807, that the defendants have to have an opportunity to examine the reporters on the same topics and subjects that I would allow the plaintiffs to question them on during their case-in-chief, nothing more and nothing less.",time%1:11:00::
But to go any further than that would mean that a reporter's veracity could be questioned each and every time something like this comes up.,time%1:11:00::
The individual who believes -- who was quoted and believes the statement was taken out of context or flatly that he didn't or she didn't say it and it's inaccurate will have the opportunity to say that during the defendants case-in-chief or at any other time during the trial.,time%1:11:00::
That is the first time that we've had that type of matter in this trial.,time%1:11:00::
And do you remember anything else that you learned at that time?,time%1:11:00::
Did there come a time when you learned that the school district board of directors had approved a biology text?,time%1:11:00::
"Now, did there come a time when you learned that the board had made a change to the biology curriculum?",time%1:11:00::
And did you learn anything else from reading the newspapers at that time?,time%1:11:00::
And that policy was implemented for the first time in January of 2005.,time%1:11:00::
One at a time.,time%1:11:00::
So this was the first time that you saw the statement that was going to be read to the students in the ninth-grade biology class.,time%1:11:00::
One at a time.,time%1:11:00::
"It was the first time that I had really ever been around Barrie Callahan, so she strikes me -that memory strikes me because my mother had known her previously.",time%1:11:00::
"In fact, I may have been walking out of the room at the time and in close proximity to her.",time%1:11:00::
And so at the time when Max was speaking -- I believe that there were people who spoke in between she and Max Pell.,time%1:11:00::
She was the high school principal at the time.,time%1:11:00::
"And at the time when you wrote the original order and you used the words &quot;perceived, saw, and heard,&quot; we were concerned, as you well know, with the word &quot;perceived&quot; in terms as to what's the thought process.",time%1:11:00::
"Well, I'm aware that that statement was modified several times.",time%1:11:00::
"The exact modification, are you telling me that from the time that they had approved it in October, it was modified before it was read in January?",time%1:11:00::
"Taking quite at random a single page (page 7) in the journals of the Gregory brothers recording an early (1846) exploration of country east and north of Perth, I find the word water used fifteen times.",time%1:11:00::
"Ten pages on (page 17), water occurs nine times but there are also the related words stream (twice), well (twice), pool, channel , and the circumlocution “essential element.",time%1:11:00::
"&quot;You can have a dozen competitors stealing your secrets at the same time,&quot; Mr. Matchett said, adding : &quot;It's a pretty good bet they won't get caught.&quot;",time%1:11:00::
"&quot;This action by queer, transgender and intersex activists loudly demonstrates our collective outrage at what is occurring in hospitals around the country five times a day to non-consenting children We acted to show the lies in the twisting of &quot;Sexual Orientation&quot; and &quot;Gender Identity and/or Expression,&quot; Medicalization of Anatomy, and the insistence of society to place people in the binary sex model, wherein a man is a man and expresses masculine characteristics, while a woman is a woman and expresses feminine characteristics, and their sexual dichotomy exists for procreation.",time%1:11:00::
"We like its familiarity, and hope it is the same every time.",time%1:11:00::
A legitimate CD bought in Jakarta's business district would cost six times that.,time%1:11:00::
But the sizable reduction in Colombia's crop means that for the first time overall coca production in the Andes is dropping at a rapid pace.,time%1:11:00::
"But tonight, for the first time in way too long, Lemmy is to meet his closest comrade.",time%1:11:00::
