context,sense
That was more than a year ago and he'd only jerked off a few times since.,time%1:11:00::
"As he thought about it now, he thought his sexual appetite had never lasted more than about fifteen minutes at a time.",time%1:11:00::
He returned each time chastened but quickly involved in new controversies.,time%1:11:00::
"When the girls are near the tree, the ceremonial horn is again sounded, this time indicating that it is time for the boys to start the race.",time%1:11:00::
HE: I've been interpellated more times than you can count.,time%1:11:00::
I'm reminded of previous times I have felt sad and I will connect them into a series by way of the synaptic corridors they pass through.,time%1:11:00::
When I see you next time round look into my eyes,time%1:11:00::
"The legitimacy of the State is called into question for the first time in at least 30 years, and the anti-authoritarianism which characterizes the youth rebellion turns into rejection of the State, a refusal to be socialized into American society.",time%1:11:00::
"The New York Times reports that divers searching the Sea of Marmara Saturday, for the first time since the disaster, found more than 150 bodies, apparently those of Turks who lived in houses facing the water.",time%1:11:00::
"The WP reports that AOL, having reprogrammed its computers to allow much longer screen-names, has also taken the step of preventing subscribers from using as their log-ons any of the celebrity names that are now for the first time technically available.",time%1:11:00::
"Since oil prices are prospective, the markets do not anticipate a global slowdown any time soon.",time%1:11:00::
They're like Wile E. Coyote going off the cliff every time.,time%1:11:00::
"Political figures turn on each other from time to time, for good and bad reasons; we're used to it.",time%1:11:00::
Mexico's ruling party lost control of the national assembly for the first time in 68 years.,time%1:11:00::
"Because it has published three times since the initial omission, it scores an additional three points.",time%1:11:00::
"By running against Giuliani (who has been reported in Vanity Fair to have a mistress--he denies it--and, by all accounts, has a sham marriage), the first lady could exact symbolic revenge on her philandering husband while advancing the fortunes of the Democratic party at the same time!",time%1:11:00::
We had compulsory attendance at Episcopal chapel services eight times a week.,time%1:11:00::
"About the same time, they suborned an IRS agent into initiating criminal tax probes of Jordache's owners, probes that ended up going nowhere but were wonderful harassment devices.",time%1:11:00::
"In the first place, the creation of frequent-flyer programs has let the rich get richer, in the sense that customers only reap the benefits of those programs if they fly the same airline each time.",time%1:11:00::
"Our Hackathletes are Malcolm Gladwell of The New Yorker ; Hanna Rosin of the New Republic ; Michael Specter , a Moscow correspondent for the New York Times ; and Geoffrey Wheatcroft , author of The Randlords and a contributor to British publications too numerous to mention.",time%1:11:00::
"Musicals can't be on the so-called cutting edge, because they take so many years to get up on stage: By the time your grunge musical opens, grunge will be out and splurge will be in.",time%1:11:00::
"We met one last time, Strand Hotel, Bombay;",time%1:11:00::
"The dilemma on whose horns you ride is that sometimes &quot;not ready&quot; means just that, and at other times it really does mean &quot;not you.&quot;",time%1:11:00::
"Punishment of children, the article recounts, &quot;should be unpleasant, memorable, and inflicted at a time that is convenient for the parent.&quot;",time%1:11:00::
"Some examples: The number of diabetes cases rose 33 percent among blacks, three times the increase among whites.",time%1:11:00::
"The paper points out that, of course, this time there isn't nearly the amount of international support for military action.",time%1:11:00::
The paper points out that Clinton suggested yesterday that one obstacle to taking action at the time was a lack of credible information about what was actually going on.,time%1:11:00::
By late that year the unemployment rate would rise above 10 percent for the first (and so far only) time since the 1930s.,time%1:11:00::
Jacob is already filing political analysis and reportage several times a week under the rubric &quot;Ballot Box&quot; (the latest addition to our collection of Boxes).,time%1:11:00::
"In other front-page news--rather, news of the front page--the Monica story retreated inside for the first time in weeks.",time%1:11:00::
"If you are a fan of old-fashioned jazz—what is now known as “traditional” or “trad” jazz—you are familiar with one of the standard “jump tunes” of the genre—a tune most commonly called Muskrat Ramble . Even if you are not a fan, you must have heard it as least a dozen times.",time%1:11:00::
"I thought that was surely the first time I had ever seen such an obvious typographical error in, of all things, a simple title on a simple 78-rpm record.",time%1:11:00::
"This time, it was MUSCAT RAMBLE.",time%1:11:00::
"Now might be as good a time as any to reveal a theft I committed at an Air Force Base near Seymour, Indiana.",time%1:11:00::
"Taking quite at random a single page (page 7) in the journals of the Gregory brothers recording an early (1846) exploration of country east and north of Perth, I find the word water used fifteen times.",time%1:11:00::
"Ten pages on (page 17), water occurs nine times but there are also the related words stream (twice), well (twice), pool, channel , and the circumlocution “essential element.”",time%1:11:00::
"Also, if you enter jump , you get the synonyms for that; but if you enter jumped , you get the (same) synonyms but inflected—including the variants leapt, leaped for leap . All in all, for a relatively primitive system, it is not too bad; but you would have to be in love with your computer to use it in preference to a far more complete books of synonyms available (especially The Synonym Finder , Rodale in the U.S. and Canada, Longman elsewhere, which offers more than 800,000 synonyms, more than three times the number listed in any other synonym book).",time%1:11:00::
"Mr. Joseph Hymes' “Do Mistake—Learn Better” [XV,1] brought to mind the time a Japanese acquaintance told me of a friend of hers who decided to tackle the original English version of three books she had enjoyed while in Japan.",time%1:11:00::
"In part, that is attributable to the designation of his correspondents, who keep him informed on language that is not within earshot, as the “Lexicographic Irregulars,” an amusing reference the first time or two it was used but now beginning to cloy.",time%1:11:00::
"True, there is an occasional mention in his column of a point raised by a correspondent, and the Letters section of the Magazine prints a comment from time to time, but an important feature of the books is their inclusion of far more writer-reader interaction than one might suspect from reading the column alone.",time%1:11:00::
"True, there is an occasional mention in his column of a point raised by a correspondent, and the Letters section of the Magazine prints a comment from time to time, but an important feature of the books is their inclusion of far more writer-reader interaction than one might suspect from reading the column alone.",time%1:11:00::
"So, golfers, the next time you are in Ireland or Scotland, ponder why the Gaels used such combustible terms for heather and eschewed the features like bells and crosses that impressed themselves on Anglo-Saxons.",time%1:11:00::
"For some, “occasionally” means several times a year; for a few, it means several times a week.",time%1:11:00::
"But, let's get one thing straight; Hitler knew how to read, and my grandmother didn't, and I'll take my grandmother any time.",time%1:11:00::
"Indy Reads is working to change these statistics, one life at a time.",time%1:11:00::
"THE GIRL SCOUT PROMISE On my honor, I will try To serve god and my country, To help people at all times, And to live by the Girl Scout Law.",time%1:11:00::
One out of every four people in the United States will be diagnosed with having cancer at one point and time in their life.,time%1:11:00::
"I know that from my desk at The Salvation Army, I have a unique perspective, and I want you to know without a doubt that we are meeting needs -- one person at a time, every day ...",time%1:11:00::
.. emergency assistance during times of crisis.,time%1:11:00::
"Every time we help someone find a solution to their employment barrier, the positive effects radiate throughout our community: The business community welcomes not only another worker, but a consumer with increased purchasing power.",time%1:11:00::
But there's no reason why we shouldn't share good news at the same time.,time%1:11:00::
"If you have any questions or concerns at any time, please do not hesitate to call me at 921-1288.",time%1:11:00::
"The results of an 18-month study completed by Public/Private Ventures showed that children participating in one-to-one Big Sister and Big Brother matches for just one year, reduced first time drug use by 46%; lowered school absenteeism by 52%; cut aggressive behavior by 33%; enhanced school performance; and improved relations with family and friends.",time%1:11:00::
"The staff member has mentioned several times to Becky that she should take the art home, but Becky doesn't want to; she wants the staff person to have it.",time%1:11:00::
"At the same time, you will be helping to preserve those wonders through your support of America's most effective conservation group.",time%1:11:00::
..four times.,time%1:11:00::
And our population is growing for the first time in decades.,time%1:11:00::
Members receive invitations to special events at various times throughout the year.,time%1:11:00::
"If such a contribution is not feasible at this time, we would of course welcome a renewal of last year's commitment.",time%1:11:00::
For the past fifteen years SEND has been working to transform the Southeast Side one project at a time.,time%1:11:00::
Her anxiety level rose every time the telephone rang.,time%1:11:00::
"That will only be the first step toward healing the pain of having been abandoned several times, neglected, and denied the happy childhood that should be every child's birthright.",time%1:11:00::
"As a friend of the Center, you are welcome to contact us at any time if we can assist you with your international needs.",time%1:11:00::
It's one of the few times you won't find the two together.,time%1:11:00::
"In addition to expanded physical facilities since the completion of Science, Engineering and Technology Building Phase Two, several of the programs in the school have expanded in terms of student and faculty size; the research and development contracts with federal and state agencies and private industry exceeded one million dollars in value for the first time last year; interaction of faculty and students with the other schools on campus increased drastically in terms of joint research projects on medical imaging, computational neuroscience and biomechanics and the partnership with Naval Avionics Warfare Center and Naval Weapons Center flourished with the moving of Electronic Manufacturing Productivity Facility from California to a new facility within one mile of the main campus.",time%1:11:00::
At one time or another we have all met classmates in the lounges in the ET Building or the Administration Building at the 38th Street campus.,time%1:11:00::
This is absolutely the last time that I will ask you to please donate a million dollars to the IUPUI Geology Alumni Fund.,time%1:11:00::
The old kiln shed has been replaced and our newly occupied and totally renovated photography building on Michigan Street has been in use for the first time.,time%1:11:00::
It's birthday time!,time%1:11:00::
"You may not have realized it at the time, but you and your fellow students were part of something very big in Indianapolis.",time%1:11:00::
"For the first time, however, the department has received a $1000 gift to begin a scholarship fund to benefit geography students only.",time%1:11:00::
Many of you responded in a positive manner by increasing your contribution or contributing to the fund for the first time.,time%1:11:00::
"I guess I encourage this method because I've always made my contributions this way, it's a &quot;painless&quot; method and at tax time I enjoy the deduction.",time%1:11:00::
"And if a person decides to be a contributor, the best time to begin is the month prior to salary increases.",time%1:11:00::
"If a major contribution is not possible at this time, a five year pledge is acceptable.",time%1:11:00::
I'm sure that stepping into private practice for the first time will be intimidating enough; but doing so without the best training possible would be twice as stressful.,time%1:11:00::
"The Endowment Fund is a way we can show our appreciation and support; and at the same time, make sure future colleagues receive the same benefits.",time%1:11:00::
"Your renewed gift to the School will enable us to sustain our reputation of excellence, to prepare our students for successful, satisfying careers, and at the same time, to enhance the value to you of your Indiana University degree.",time%1:11:00::
